{"blinded":true,"contractVersion":"m3-1-blind-packet-v1","custodialMappingRequired":true,"deliveryContract":{"annotationBundleOnly":true,"repositoryAccessPermitted":false,"sourceManifestAccessPermitted":false,"splitAccessPermitted":false},"executionBlocker":null,"humanExecutable":true,"orderSeedSha256":"4010637aaea6209e02f4873b57f62e1d32bf75c449d1e55adb17f532749f804d","packetId":"blind_packet_m3_1_public_pilot_v1","packetSha256":"73c2a4d41ef468de9113d09feec42672f2c4932caeb5165c523b2695a4e446e3","targets":[{"blindTargetId":"blind_target_01f6d99cc439e16374ba3f90ea0624cc","context":{"artifactPath":"blind-context/context_42084d3203d9dbfbd2dfcb90.svg","artifactSha256":"42084d3203d9dbfbd2dfcb9093fa155567705b8f8731cb4d2477ea5e8eee7d6c","byteLength":60852,"mediaType":"image/svg+xml","renderingContract":{"externalAssetsFetched":false,"limitations":["Font identity and production renderer capture are not frozen; annotation is process-pilot evidence only."],"mode":"browser-native-isolated-svg","sourceByteTreatment":"exact-source-subtree-plus-inert-packet-comment","sourceScope":"exact-svg-document"},"targetLocator":{"mode":"context-structural-path","structuralPathWithinContext":"/g[0]/text[16]"}},"neutralOrder":1,"ruleId":"svg/text-ink-collision"},{"blindTargetId":"blind_target_028a040fe3a93e5d5f3b8fce434d71bd","context":{"artifactPath":"blind-context/context_42084d3203d9dbfbd2dfcb90.svg","artifactSha256":"42084d3203d9dbfbd2dfcb9093fa155567705b8f8731cb4d2477ea5e8eee7d6c","byteLength":60852,"mediaType":"image/svg+xml","renderingContract":{"externalAssetsFetched":false,"limitations":["Font identity and production renderer capture are not frozen; annotation is process-pilot evidence only."],"mode":"browser-native-isolated-svg","sourceByteTreatment":"exact-source-subtree-plus-inert-packet-comment","sourceScope":"exact-svg-document"},"targetLocator":{"mode":"context-structural-path","structuralPathWithinContext":"/g[0]/text[0]"}},"neutralOrder":2,"ruleId":"svg/text-overflows-viewport"},{"blindTargetId":"blind_target_029e64b729fd03832b8bfbb6355d1a33","context":{"artifactPath":"blind-context/context_f3e0e75ad817ad43278dd164.svg","artifactSha256":"f3e0e75ad817ad43278dd1646d6e7a2bf8095f4afea6c75eff72e17edbb611e4","byteLength":52312,"mediaType":"image/svg+xml","renderingContract":{"externalAssetsFetched":false,"limitations":["Font identity and production renderer capture are not frozen; annotation is process-pilot evidence only."],"mode":"browser-native-isolated-svg","sourceByteTreatment":"exact-source-subtree-plus-inert-packet-comment","sourceScope":"exact-svg-document"},"targetLocator":{"mode":"context-structural-path","structuralPathWithinContext":"/g[0]/text[10]"}},"neutralOrder":3,"ruleId":"svg/text-clipped"},{"blindTargetId":"blind_target_066c099cee8c9f3f57a6eafcf242b7c6","context":{"artifactPath":"blind-context/context_563d3f3201920464a75c9f08.svg","artifactSha256":"563d3f3201920464a75c9f087b8e8534bc07425a502949b153746e0b803fa565","byteLength":4605,"mediaType":"image/svg+xml","renderingContract":{"externalAssetsFetched":false,"limitations":["Only the embedded inline SVG is presented; the unstyled containing HTML page is not claimed as a faithful site render.","Font identity and production renderer capture are not frozen; annotation is process-pilot evidence only."],"mode":"browser-native-isolated-svg","sourceByteTreatment":"exact-source-subtree-plus-inert-packet-comment","sourceScope":"embedded-inline-svg-only"},"targetLocator":{"mode":"context-structural-path","structuralPathWithinContext":"/text[20]"}},"neutralOrder":4,"ruleId":"svg/text-ink-collision"},{"blindTargetId":"blind_target_067ee17557345c35b0274f144f2c9443","context":{"artifactPath":"blind-context/context_ee105b0fbb5fc23d367329df.svg","artifactSha256":"ee105b0fbb5fc23d367329df3ab0c9a6751d0ce919293669b062e540a6b7c5ef","byteLength":2223,"mediaType":"image/svg+xml","renderingContract":{"externalAssetsFetched":false,"limitations":["Only the embedded inline SVG is presented; the unstyled containing HTML page is not claimed as a faithful site render.","Font identity and production renderer capture are not frozen; annotation is process-pilot evidence only."],"mode":"browser-native-isolated-svg","sourceByteTreatment":"exact-source-subtree-plus-inert-packet-comment","sourceScope":"embedded-inline-svg-only"},"targetLocator":{"mode":"context-structural-path","structuralPathWithinContext":"/text[5]"}},"neutralOrder":5,"ruleId":"svg/text-clipped"},{"blindTargetId":"blind_target_0771ed6c354d35ffaf1ea1bad31e1ddc","context":{"artifactPath":"blind-context/context_f3e0e75ad817ad43278dd164.svg","artifactSha256":"f3e0e75ad817ad43278dd1646d6e7a2bf8095f4afea6c75eff72e17edbb611e4","byteLength":52312,"mediaType":"image/svg+xml","renderingContract":{"externalAssetsFetched":false,"limitations":["Font identity and production renderer capture are not frozen; annotation is process-pilot evidence only."],"mode":"browser-native-isolated-svg","sourceByteTreatment":"exact-source-subtree-plus-inert-packet-comment","sourceScope":"exact-svg-document"},"targetLocator":{"mode":"context-structural-path","structuralPathWithinContext":"/g[0]/text[14]"}},"neutralOrder":6,"ruleId":"svg/text-ink-collision"},{"blindTargetId":"blind_target_07cc7a3088a1ad985c1d2017e9de5dee","context":{"artifactPath":"blind-context/context_42084d3203d9dbfbd2dfcb90.svg","artifactSha256":"42084d3203d9dbfbd2dfcb9093fa155567705b8f8731cb4d2477ea5e8eee7d6c","byteLength":60852,"mediaType":"image/svg+xml","renderingContract":{"externalAssetsFetched":false,"limitations":["Font identity and production renderer capture are not frozen; annotation is process-pilot evidence only."],"mode":"browser-native-isolated-svg","sourceByteTreatment":"exact-source-subtree-plus-inert-packet-comment","sourceScope":"exact-svg-document"},"targetLocator":{"mode":"context-structural-path","structuralPathWithinContext":"/g[0]/text[16]"}},"neutralOrder":7,"ruleId":"svg/text-clipped"},{"blindTargetId":"blind_target_0828937d08e775c3f49cfbfae5c12e17","context":{"artifactPath":"blind-context/context_563d3f3201920464a75c9f08.svg","artifactSha256":"563d3f3201920464a75c9f087b8e8534bc07425a502949b153746e0b803fa565","byteLength":4605,"mediaType":"image/svg+xml","renderingContract":{"externalAssetsFetched":false,"limitations":["Only the embedded inline SVG is presented; the unstyled containing HTML page is not claimed as a faithful site render.","Font identity and production renderer capture are not frozen; annotation is process-pilot evidence only."],"mode":"browser-native-isolated-svg","sourceByteTreatment":"exact-source-subtree-plus-inert-packet-comment","sourceScope":"embedded-inline-svg-only"},"targetLocator":{"mode":"context-structural-path","structuralPathWithinContext":"/text[12]"}},"neutralOrder":8,"ruleId":"svg/text-ink-collision"},{"blindTargetId":"blind_target_0d632fc1aea7f777371be9f8cf929538","context":{"artifactPath":"blind-context/context_563d3f3201920464a75c9f08.svg","artifactSha256":"563d3f3201920464a75c9f087b8e8534bc07425a502949b153746e0b803fa565","byteLength":4605,"mediaType":"image/svg+xml","renderingContract":{"externalAssetsFetched":false,"limitations":["Only the embedded inline SVG is presented; the unstyled containing HTML page is not claimed as a faithful site render.","Font identity and production renderer capture are not frozen; annotation is process-pilot evidence only."],"mode":"browser-native-isolated-svg","sourceByteTreatment":"exact-source-subtree-plus-inert-packet-comment","sourceScope":"embedded-inline-svg-only"},"targetLocator":{"mode":"context-structural-path","structuralPathWithinContext":"/text[20]"}},"neutralOrder":9,"ruleId":"svg/text-overflows-viewport"},{"blindTargetId":"blind_target_0e54868a1c90d3dc4042b7c0597a35f3","context":{"artifactPath":"blind-context/context_f3e0e75ad817ad43278dd164.svg","artifactSha256":"f3e0e75ad817ad43278dd1646d6e7a2bf8095f4afea6c75eff72e17edbb611e4","byteLength":52312,"mediaType":"image/svg+xml","renderingContract":{"externalAssetsFetched":false,"limitations":["Font identity and production renderer capture are not frozen; annotation is process-pilot evidence only."],"mode":"browser-native-isolated-svg","sourceByteTreatment":"exact-source-subtree-plus-inert-packet-comment","sourceScope":"exact-svg-document"},"targetLocator":{"mode":"context-structural-path","structuralPathWithinContext":"/g[0]/text[12]"}},"neutralOrder":10,"ruleId":"svg/text-clipped"},{"blindTargetId":"blind_target_0e98e1c35badf7d3738e4f23b7c842fb","context":{"artifactPath":"blind-context/context_ee105b0fbb5fc23d367329df.svg","artifactSha256":"ee105b0fbb5fc23d367329df3ab0c9a6751d0ce919293669b062e540a6b7c5ef","byteLength":2223,"mediaType":"image/svg+xml","renderingContract":{"externalAssetsFetched":false,"limitations":["Only the embedded inline SVG is presented; the unstyled containing HTML page is not claimed as a faithful site render.","Font identity and production renderer capture are not frozen; annotation is process-pilot evidence only."],"mode":"browser-native-isolated-svg","sourceByteTreatment":"exact-source-subtree-plus-inert-packet-comment","sourceScope":"embedded-inline-svg-only"},"targetLocator":{"mode":"context-structural-path","structuralPathWithinContext":"/text[5]"}},"neutralOrder":11,"ruleId":"svg/text-ink-collision"},{"blindTargetId":"blind_target_1228d82eb6113a64aa7de3842868d80d","context":{"artifactPath":"blind-context/context_563d3f3201920464a75c9f08.svg","artifactSha256":"563d3f3201920464a75c9f087b8e8534bc07425a502949b153746e0b803fa565","byteLength":4605,"mediaType":"image/svg+xml","renderingContract":{"externalAssetsFetched":false,"limitations":["Only the embedded inline SVG is presented; the unstyled containing HTML page is not claimed as a faithful site render.","Font identity and production renderer capture are not frozen; annotation is process-pilot evidence only."],"mode":"browser-native-isolated-svg","sourceByteTreatment":"exact-source-subtree-plus-inert-packet-comment","sourceScope":"embedded-inline-svg-onl